Test,Test Suite,Result,Resolution,Issue
"Login: should not be able to login with wrong username","Login","Failed",,
"Test Run: Test Run can be created with Milestone","Test Run: Viewer","Failed",,
"Login: should be able to login as admin","Login","Passed",,
"Test Run: Test Run can be created without Milestone","Test Run: Viewer","Passed",,
"Test Run: Build name should be inherited from create page","Test Run: Viewer","Passed",,
"Login: should not be able to login with wrong password","Login","Pending",,